{
  "compilerVersion": "0.1.0",
  "diagnostics": [],
  "irHash": "sha256:1de73d4c289c64fe5cc8b977fac50aa1e5c2ee6201ddfd40afabd293b2b6973a",
  "irVersion": "1.0.0",
  "modelHash": "sha256:0b361c65e583962efcb6548c21f662b90895463ba5d0c8b35e3a717e7a9f9771",
  "name": "FallingFiresOnlyWhenTheValueDecreases",
  "nodes": [
    {
      "args": {
        "awaitAck": true,
        "onError": "continue",
        "signal": "s0",
        "value": {
          "$const": true,
          "type": "boolean"
        }
      },
      "id": "n2",
      "next": {
        "error": null,
        "next": null
      },
      "opcode": "vehicle.write",
      "outputs": {
        "error": {
          "type": "string"
        },
        "ok": {
          "type": "boolean"
        }
      },
      "src": {
        "blockId": "b2"
      }
    }
  ],
  "signals": [
    {
      "access": [
        "write"
      ],
      "dataType": "boolean",
      "id": "s0",
      "path": "Vehicle.Body.Lights.Hazard.IsSignaling",
      "unit": null,
      "vssType": "actuator"
    },
    {
      "access": [
        "subscribe"
      ],
      "dataType": "float",
      "id": "s1",
      "path": "Vehicle.Speed",
      "unit": "km/h",
      "vssType": "sensor"
    }
  ],
  "sourceGraphHash": "sha256:81b8569bb336a16a8189c6b1c4a9f14ffc5a2df03c08f2c09d6a5c6b61ddcc25",
  "state": [],
  "topics": [],
  "triggers": [
    {
      "concurrency": {
        "policy": "restart"
      },
      "entry": "n2",
      "id": "n1",
      "opcode": "event.signal_changed",
      "outputs": {
        "previous": {
          "type": "float",
          "unit": "km/h"
        },
        "timestamp": {
          "type": "timestamp"
        },
        "value": {
          "type": "float",
          "unit": "km/h"
        }
      },
      "props": {
        "debounceMs": 0,
        "mode": "falling"
      },
      "signal": "s1",
      "src": {
        "blockId": "b1"
      }
    }
  ],
  "workflowId": "c03_falling",
  "workflowRevision": 1
}
