{
  "compilerVersion": "0.1.0",
  "diagnostics": [],
  "irHash": "sha256:5ffa1a159a78357033a6d5342e466fd0191c2e5128358f117eabb7855d503c25",
  "irVersion": "1.0.0",
  "modelHash": "sha256:0b361c65e583962efcb6548c21f662b90895463ba5d0c8b35e3a717e7a9f9771",
  "name": "WaitUntilWhoseConditionIsAlreadyTrueContinuesImmediately",
  "nodes": [
    {
      "args": {
        "condition": {
          "$expr": {
            "l": {
              "$signal": "s1"
            },
            "op": ">",
            "r": {
              "$const": "100",
              "type": "int64",
              "unit": "km/h"
            },
            "type": "boolean"
          }
        },
        "timeoutMs": 5000
      },
      "id": "n2",
      "next": {
        "ok": "n3",
        "timeout": null
      },
      "opcode": "control.wait_until",
      "src": {
        "blockId": "b2"
      }
    },
    {
      "args": {
        "awaitAck": true,
        "onError": "continue",
        "signal": "s0",
        "value": {
          "$const": true,
          "type": "boolean"
        }
      },
      "id": "n3",
      "next": {
        "error": null,
        "next": null
      },
      "opcode": "vehicle.write",
      "outputs": {
        "error": {
          "type": "string"
        },
        "ok": {
          "type": "boolean"
        }
      },
      "src": {
        "blockId": "b3"
      }
    }
  ],
  "signals": [
    {
      "access": [
        "write"
      ],
      "dataType": "boolean",
      "id": "s0",
      "path": "Vehicle.Body.Lights.Hazard.IsSignaling",
      "unit": null,
      "vssType": "actuator"
    },
    {
      "access": [
        "subscribe"
      ],
      "dataType": "float",
      "id": "s1",
      "path": "Vehicle.Speed",
      "unit": "km/h",
      "vssType": "sensor"
    }
  ],
  "sourceGraphHash": "sha256:b1d77006f204b233c3dac1027e459548632d4e41316d702fe6fe139f87391bec",
  "state": [],
  "topics": [],
  "triggers": [
    {
      "entry": "n2",
      "id": "n1",
      "opcode": "event.app_start",
      "outputs": {},
      "props": {},
      "src": {
        "blockId": "b1"
      }
    }
  ],
  "workflowId": "c26_wait_until_already_true",
  "workflowRevision": 1
}
