{
  "compilerVersion": "0.1.0",
  "diagnostics": [],
  "irHash": "sha256:c8bc53590560786bdb9b8dc313c114dbc333fa0203e849833bd20432b6688095",
  "irVersion": "1.0.0",
  "modelHash": "sha256:0b361c65e583962efcb6548c21f662b90895463ba5d0c8b35e3a717e7a9f9771",
  "name": "DebounceFiresOnceDebounceMsAfterTheLastChangeOfABurst",
  "nodes": [
    {
      "args": {
        "awaitAck": true,
        "onError": "continue",
        "signal": "s0",
        "value": {
          "$const": true,
          "type": "boolean"
        }
      },
      "id": "n2",
      "next": {
        "error": null,
        "next": null
      },
      "opcode": "vehicle.write",
      "outputs": {
        "error": {
          "type": "string"
        },
        "ok": {
          "type": "boolean"
        }
      },
      "src": {
        "blockId": "b2"
      }
    }
  ],
  "signals": [
    {
      "access": [
        "write"
      ],
      "dataType": "boolean",
      "id": "s0",
      "path": "Vehicle.Body.Lights.Hazard.IsSignaling",
      "unit": null,
      "vssType": "actuator"
    },
    {
      "access": [
        "subscribe"
      ],
      "dataType": "float",
      "id": "s1",
      "path": "Vehicle.Speed",
      "unit": "km/h",
      "vssType": "sensor"
    }
  ],
  "sourceGraphHash": "sha256:7c3c46759949b5a7cf926a86e60d934f8f1214ed3c35a70e7377956d0b6fa761",
  "state": [],
  "topics": [],
  "triggers": [
    {
      "concurrency": {
        "policy": "restart"
      },
      "entry": "n2",
      "id": "n1",
      "opcode": "event.signal_changed",
      "outputs": {
        "previous": {
          "type": "float",
          "unit": "km/h"
        },
        "timestamp": {
          "type": "timestamp"
        },
        "value": {
          "type": "float",
          "unit": "km/h"
        }
      },
      "props": {
        "debounceMs": 500,
        "mode": "any"
      },
      "signal": "s1",
      "src": {
        "blockId": "b1"
      }
    }
  ],
  "workflowId": "c07_debounce",
  "workflowRevision": 1
}
