{
  "compilerVersion": "0.1.0",
  "diagnostics": [],
  "irHash": "sha256:6264903a0cab1db4a95d8094c78c9ca61c164f0eef3a7c312189089c08bf93ca",
  "irVersion": "1.0.0",
  "modelHash": "sha256:0b361c65e583962efcb6548c21f662b90895463ba5d0c8b35e3a717e7a9f9771",
  "name": "AutoDoorLock",
  "nodes": [
    {
      "args": {
        "awaitAck": true,
        "onError": "continue",
        "signal": "s0",
        "value": {
          "$const": true,
          "type": "boolean"
        }
      },
      "id": "n2",
      "next": {
        "error": null,
        "next": "n3"
      },
      "opcode": "vehicle.write",
      "outputs": {
        "error": {
          "type": "string"
        },
        "ok": {
          "type": "boolean"
        }
      },
      "src": {
        "blockId": "b2"
      }
    },
    {
      "args": {
        "awaitAck": true,
        "onError": "continue",
        "signal": "s1",
        "value": {
          "$const": true,
          "type": "boolean"
        }
      },
      "id": "n3",
      "next": {
        "error": null,
        "next": "n4"
      },
      "opcode": "vehicle.write",
      "outputs": {
        "error": {
          "type": "string"
        },
        "ok": {
          "type": "boolean"
        }
      },
      "src": {
        "blockId": "b3"
      }
    },
    {
      "args": {
        "awaitAck": true,
        "onError": "continue",
        "signal": "s2",
        "value": {
          "$const": true,
          "type": "boolean"
        }
      },
      "id": "n4",
      "next": {
        "error": null,
        "next": "n5"
      },
      "opcode": "vehicle.write",
      "outputs": {
        "error": {
          "type": "string"
        },
        "ok": {
          "type": "boolean"
        }
      },
      "src": {
        "blockId": "b4"
      }
    },
    {
      "args": {
        "awaitAck": true,
        "onError": "continue",
        "signal": "s3",
        "value": {
          "$const": true,
          "type": "boolean"
        }
      },
      "id": "n5",
      "next": {
        "error": null,
        "next": null
      },
      "opcode": "vehicle.write",
      "outputs": {
        "error": {
          "type": "string"
        },
        "ok": {
          "type": "boolean"
        }
      },
      "src": {
        "blockId": "b5"
      }
    }
  ],
  "signals": [
    {
      "access": [
        "write"
      ],
      "dataType": "boolean",
      "id": "s0",
      "path": "Vehicle.Cabin.Door.Row1.DriverSide.IsLocked",
      "unit": null,
      "vssType": "actuator"
    },
    {
      "access": [
        "write"
      ],
      "dataType": "boolean",
      "id": "s1",
      "path": "Vehicle.Cabin.Door.Row1.PassengerSide.IsLocked",
      "unit": null,
      "vssType": "actuator"
    },
    {
      "access": [
        "write"
      ],
      "dataType": "boolean",
      "id": "s2",
      "path": "Vehicle.Cabin.Door.Row2.DriverSide.IsLocked",
      "unit": null,
      "vssType": "actuator"
    },
    {
      "access": [
        "write"
      ],
      "dataType": "boolean",
      "id": "s3",
      "path": "Vehicle.Cabin.Door.Row2.PassengerSide.IsLocked",
      "unit": null,
      "vssType": "actuator"
    },
    {
      "access": [
        "subscribe"
      ],
      "dataType": "float",
      "id": "s4",
      "path": "Vehicle.Speed",
      "unit": "km/h",
      "vssType": "sensor"
    }
  ],
  "sourceGraphHash": "sha256:cc0f26f93940dc2e986f9ddc76d492671059ab9ce50eda33410bc4404bce2681",
  "state": [],
  "topics": [],
  "triggers": [
    {
      "concurrency": {
        "policy": "ignore"
      },
      "entry": "n2",
      "id": "n1",
      "opcode": "event.signal_changed",
      "outputs": {
        "previous": {
          "type": "float",
          "unit": "km/h"
        },
        "timestamp": {
          "type": "timestamp"
        },
        "value": {
          "type": "float",
          "unit": "km/h"
        }
      },
      "props": {
        "debounceMs": 0,
        "mode": "crosses_above",
        "threshold": {
          "$const": 15,
          "type": "float",
          "unit": "km/h"
        }
      },
      "signal": "s4",
      "src": {
        "blockId": "b1"
      }
    }
  ],
  "workflowId": "gw_d",
  "workflowRevision": 1
}
