{
  "compilerVersion": "0.1.0",
  "diagnostics": [],
  "irHash": "sha256:b1897bf09c1d07826e0f176383c23884d834fe727ba4145aa48f3f18bf088849",
  "irVersion": "1.0.0",
  "modelHash": "sha256:0b361c65e583962efcb6548c21f662b90895463ba5d0c8b35e3a717e7a9f9771",
  "name": "ForwardCollision",
  "nodes": [
    {
      "args": {
        "condition": {
          "$expr": {
            "l": {
              "$signal": "s3"
            },
            "op": "<",
            "r": {
              "$const": "10",
              "type": "int64",
              "unit": "percent"
            },
            "type": "boolean"
          }
        }
      },
      "id": "n2",
      "next": {
        "else": "n6",
        "then": "n3"
      },
      "opcode": "control.branch",
      "src": {
        "blockId": "b2"
      }
    },
    {
      "args": {
        "payload": {
          "$template": [
            "{\"severity\":\"critical\",\"title\":",
            {
              "$expr": {
                "op": "json.string",
                "type": "string",
                "value": {
                  "$template": [
                    "Collision risk"
                  ]
                }
              }
            },
            ",\"message\":",
            {
              "$expr": {
                "op": "json.string",
                "type": "string",
                "value": {
                  "$template": [
                    "Brake now: ",
                    {
                      "$signal": "s4"
                    },
                    " km/h"
                  ]
                }
              }
            },
            ",\"ts\":",
            {
              "$expr": {
                "args": [],
                "op": "now_ms",
                "type": "timestamp"
              }
            },
            "}"
          ]
        },
        "payloadType": "json",
        "qos": 0,
        "retain": false,
        "topic": "t0"
      },
      "id": "n3",
      "next": {
        "error": null,
        "next": "n4"
      },
      "opcode": "comm.mqtt_publish",
      "src": {
        "blockId": "b3"
      }
    },
    {
      "args": {
        "awaitAck": true,
        "onError": "continue",
        "signal": "s2",
        "value": {
          "$const": "ACTIVE",
          "type": "string"
        }
      },
      "id": "n4",
      "next": {
        "error": null,
        "next": "n5"
      },
      "opcode": "vehicle.write",
      "outputs": {
        "error": {
          "type": "string"
        },
        "ok": {
          "type": "boolean"
        }
      },
      "src": {
        "blockId": "b4"
      }
    },
    {
      "args": {
        "awaitAck": true,
        "onError": "continue",
        "signal": "s0",
        "value": {
          "$const": false,
          "type": "boolean"
        }
      },
      "id": "n5",
      "next": {
        "error": null,
        "next": null
      },
      "opcode": "vehicle.write",
      "outputs": {
        "error": {
          "type": "string"
        },
        "ok": {
          "type": "boolean"
        }
      },
      "src": {
        "blockId": "b5"
      }
    },
    {
      "args": {
        "payload": {
          "$template": [
            "{\"severity\":\"info\",\"title\":",
            {
              "$expr": {
                "op": "json.string",
                "type": "string",
                "value": {
                  "$template": [
                    "Driver braking"
                  ]
                }
              }
            },
            ",\"message\":",
            {
              "$expr": {
                "op": "json.string",
                "type": "string",
                "value": {
                  "$template": [
                    "Pedal ",
                    {
                      "$signal": "s3"
                    },
                    " %"
                  ]
                }
              }
            },
            ",\"ts\":",
            {
              "$expr": {
                "args": [],
                "op": "now_ms",
                "type": "timestamp"
              }
            },
            "}"
          ]
        },
        "payloadType": "json",
        "qos": 0,
        "retain": false,
        "topic": "t0"
      },
      "id": "n6",
      "next": {
        "error": null,
        "next": null
      },
      "opcode": "comm.mqtt_publish",
      "src": {
        "blockId": "b6"
      }
    },
    {
      "args": {
        "awaitAck": true,
        "onError": "continue",
        "signal": "s2",
        "value": {
          "$const": "INACTIVE",
          "type": "string"
        }
      },
      "id": "n8",
      "next": {
        "error": null,
        "next": null
      },
      "opcode": "vehicle.write",
      "outputs": {
        "error": {
          "type": "string"
        },
        "ok": {
          "type": "boolean"
        }
      },
      "src": {
        "blockId": "b8"
      }
    }
  ],
  "signals": [
    {
      "access": [
        "write"
      ],
      "dataType": "boolean",
      "id": "s0",
      "path": "Vehicle.ADAS.CruiseControl.IsActive",
      "unit": null,
      "vssType": "actuator"
    },
    {
      "access": [
        "subscribe"
      ],
      "dataType": "boolean",
      "id": "s1",
      "path": "Vehicle.ADAS.ObstacleDetection.IsWarning",
      "unit": null,
      "vssType": "sensor"
    },
    {
      "access": [
        "write"
      ],
      "dataType": "string",
      "id": "s2",
      "path": "Vehicle.Body.Lights.Brake.IsActive",
      "unit": null,
      "vssType": "actuator"
    },
    {
      "access": [
        "subscribe"
      ],
      "dataType": "uint8",
      "id": "s3",
      "path": "Vehicle.Chassis.Brake.PedalPosition",
      "unit": "percent",
      "vssType": "sensor"
    },
    {
      "access": [
        "subscribe"
      ],
      "dataType": "float",
      "id": "s4",
      "path": "Vehicle.Speed",
      "unit": "km/h",
      "vssType": "sensor"
    }
  ],
  "sourceGraphHash": "sha256:4ef3238f81382ef9d7663b2d274627a00eb3faa8e25ff0b446c4adbf9d325808",
  "state": [],
  "topics": [
    {
      "direction": "write",
      "id": "t0",
      "topic": "simvehicleapp/forward-collision/hmi"
    }
  ],
  "triggers": [
    {
      "concurrency": {
        "policy": "restart"
      },
      "entry": "n2",
      "id": "n1",
      "opcode": "event.condition",
      "outputs": {
        "timestamp": {
          "type": "timestamp"
        }
      },
      "props": {
        "debounceMs": 0,
        "expr": {
          "$expr": {
            "l": {
              "$signal": "s1"
            },
            "op": "&&",
            "r": {
              "$expr": {
                "l": {
                  "$signal": "s4"
                },
                "op": ">",
                "r": {
                  "$const": "30",
                  "type": "int64",
                  "unit": "km/h"
                },
                "type": "boolean"
              }
            },
            "type": "boolean"
          }
        }
      },
      "src": {
        "blockId": "b1"
      }
    },
    {
      "concurrency": {
        "policy": "restart"
      },
      "entry": "n8",
      "id": "n7",
      "opcode": "event.condition",
      "outputs": {
        "timestamp": {
          "type": "timestamp"
        }
      },
      "props": {
        "debounceMs": 0,
        "expr": {
          "$expr": {
            "a": {
              "$signal": "s1"
            },
            "op": "!",
            "type": "boolean"
          }
        }
      },
      "src": {
        "blockId": "b7"
      }
    }
  ],
  "workflowId": "c43_fcw",
  "workflowRevision": 1
}
